{
  "$schema": "https://json-schema.org/draft/2020-12/schema",
  "$id": "https://resonance.local/schemas/sensor-event.schema.json",
  "title": "ResonanceSensorEvent",
  "description": "Authoritative schema for acoustic and vibration anomaly-monitoring telemetry events across Python, Node.js, and React.",
  "type": "object",
  "required": [
    "schema_version",
    "event_id",
    "sensor_id",
    "timestamp",
    "sequence",
    "status",
    "anomaly_score",
    "features",
    "source"
  ],
  "additionalProperties": false,
  "properties": {
    "schema_version": {
      "type": "string",
      "const": "1.0",
      "description": "Semantic schema contract version. Restricted strictly to '1.0' for Phase 1."
    },
    "event_id": {
      "type": "string",
      "minLength": 1,
      "description": "Globally unique identifier for the event instance (e.g., evt_000001 or UUID). Note: Uniqueness across events is enforced at the ingest/stream runtime layer, as single-payload JSON Schema cannot enforce cross-payload uniqueness."
    },
    "sensor_id": {
      "type": "string",
      "minLength": 1,
      "description": "Unique identifier for the physical structure sensor point or simulated telemetry node (e.g., Pillar_A)."
    },
    "timestamp": {
      "type": "string",
      "format": "date-time",
      "pattern": "^[0-9]{4}-[0-9]{2}-[0-9]{2}T[0-9]{2}:[0-9]{2}:[0-9]{2}(\\.[0-9]+)?Z$",
      "description": "UTC timestamp in RFC 3339 format strictly with 'Z' timezone designator (ISO 8601 subset, e.g., 2026-10-24T14:30:00.000Z). Non-UTC offsets are prohibited."
    },
    "sequence": {
      "type": "integer",
      "minimum": 1,
      "description": "Strictly positive integer sequence number scoped per sensor stream. Note: Monotonic progression across events is enforced at the ingest/stream runtime layer, as single-payload JSON Schema validates individual payloads in isolation."
    },
    "status": {
      "type": "string",
      "enum": ["normal", "anomaly"],
      "description": "Classification result generated by anomaly detection model inference evaluated against configured decision thresholds."
    },
    "anomaly_score": {
      "type": "number",
      "minimum": 0.0,
      "description": "Unbounded non-negative anomaly severity score (0.0 = nominal baseline state; larger values represent greater deviation from baseline). NOTE: This is a non-negative continuous severity/distance metric, NOT a bounded probability or percentage."
    },
    "features": {
      "type": "object",
      "description": "Key acoustic/vibration signal features extracted over the sliding observation window.",
      "required": [
        "rms",
        "std_dev",
        "dominant_frequency_hz"
      ],
      "additionalProperties": false,
      "properties": {
        "rms": {
          "type": "number",
          "minimum": 0.0,
          "description": "Root Mean Square (RMS) acceleration or displacement magnitude over the observation window. Non-negative finite float."
        },
        "std_dev": {
          "type": "number",
          "minimum": 0.0,
          "description": "Standard deviation of signal amplitudes over the observation window. Non-negative finite float."
        },
        "dominant_frequency_hz": {
          "type": "number",
          "minimum": 0.0,
          "description": "Peak spectral frequency identified via Fast Fourier Transform (FFT) analysis within the window, in Hertz (Hz). Non-negative finite float."
        }
      }
    },
    "source": {
      "type": "string",
      "enum": ["simulation", "hardware"],
      "description": "Data provenance tag indicating whether telemetry originates from synthetic/dataset replay simulation or physical microcontroller hardware."
    }
  }
}
